,Name,Purpose,Unnamed: 0,Blob,Sentiment Score
154,Robles-Kerr,Configurable fresh-thinking Graphical User Interface for transform e-business models,,Configurable fresh-thinking Graphical User Interface for transform e-business models,0.0
153,Ali-Cain,Extended systematic knowledge user for re-contextualize real-time platforms,,Extended systematic knowledge user for re-contextualize real-time platforms,0.0
152,"Walton, Webb and Watkins",Front-line value-added circuit for architect synergistic models,,Front-line value-added circuit for architect synergistic models,0.0
151,Cole Inc,Synergized composite capacity for integrate value-added functionalities,,Synergized composite capacity for integrate value-added functionalities,0.0
150,"Pugh, Lewis and Williams",Exclusive analyzing intranet for evolve global portals,,Exclusive analyzing intranet for evolve global portals,0.0
149,"Meadows, Vazquez and Martin",Re-contextualized value-added portal for iterate back-end bandwidth,,Re-contextualized value-added portal for iterate back-end bandwidth,0.0
148,"Dominguez, Jackson and Clark'","Proactive directional encryption for unleash mission-critical '
 'mindshare",,"Proactive directional encryption for unleash mission-critical '
 'mindshare",0.0
145,Lee Group',"Multi-channeled needs-based help-desk for evolve open-source '
 'e-business'",,"Multi-channeled needs-based help-desk for evolve open-source '
 'e-business'",0.0
143,Vasquez-Silva,Compatible national solution for aggregate dynamic mindshare,,Compatible national solution for aggregate dynamic mindshare,0.0
142,"Williams, Wilson and Morris",Fundamental maximized initiative for harness efficient e-commerce,,Fundamental maximized initiative for harness efficient e-commerce,0.0
141,Weiss Group',"Multi-channeled impactful infrastructure for evolve holistic '
 'web-readiness'",,"Multi-channeled impactful infrastructure for evolve holistic '
 'web-readiness'",0.0
139,"Nunez, Miller and Rhodes'","Business-focused object-oriented toolset for envisioneer efficient '
 'users'",,"Business-focused object-oriented toolset for envisioneer efficient '
 'users'",0.0
138,Morales LLC,Networked mobile moratorium for enhance viral niches,,Networked mobile moratorium for enhance viral niches,0.0
167,Marshall Inc,Object-based cohesive circuit for matrix turn-key architectures,,Object-based cohesive circuit for matrix turn-key architectures,0.0
168,Graham LLC,Optimized encompassing toolset for generate scalable paradigms,,Optimized encompassing toolset for generate scalable paradigms,0.0
169,Cooper-Guerrero,Down-sized exuding hardware for syndicate proactive schemas,,Down-sized exuding hardware for syndicate proactive schemas,0.0
170,Turner Group,Phased eco-centric open architecture for exploit one-to-one content,,Phased eco-centric open architecture for exploit one-to-one content,0.0
189,Willis and Sons,Team-oriented holistic neural-net for productize killer partnerships,,Team-oriented holistic neural-net for productize killer partnerships,0.0
188,"Vance, Patel and Winters",Synergized 4thgeneration instruction set for unleash cross-media systems,,Synergized 4thgeneration instruction set for unleash cross-media systems,0.0
252,"Fernandez, George and Hunt",Virtual heuristic paradigm for benchmark B2B web-readiness,,Virtual heuristic paradigm for benchmark B2B web-readiness,0.0
187,Butler Group,Face-to-face needs-based secured line for scale strategic users,,Face-to-face needs-based secured line for scale strategic users,0.0
186,Mcintyre Ltd,Realigned actuating data-warehouse for brand proactive communities,,Realigned actuating data-warehouse for brand proactive communities,0.0
185,Reyes PLC,Customizable methodical migration for unleash best-of-breed convergence,,Customizable methodical migration for unleash best-of-breed convergence,0.0
253,Johnston-Palmer,Reactive fresh-thinking knowledge user for scale distributed vortals,,Reactive fresh-thinking knowledge user for scale distributed vortals,0.0
183,Butler and Sons,Fundamental contextually-based challenge for embrace revolutionary systems,,Fundamental contextually-based challenge for embrace revolutionary systems,0.0
182,Delgado Group,Synergized full-range framework for exploit B2B web-readiness,,Synergized full-range framework for exploit B2B web-readiness,0.0
181,Diaz-Ross,Configurable explicit customer loyalty for brand dynamic models,,Configurable explicit customer loyalty for brand dynamic models,0.0
254,"Reyes, Wilson and Lyons",Operative zero-defect database for mesh viral channels,,Operative zero-defect database for mesh viral channels,0.0
179,"Murillo, Johnson and Garrett",Polarized impactful open architecture for integrate plug-and-play e-tailers,,Polarized impactful open architecture for integrate plug-and-play e-tailers,0.0
178,"Jones, Chaney and Santana",Optional composite info-mediaries for engineer dot-com e-tailers,,Optional composite info-mediaries for engineer dot-com e-tailers,0.0
177,"Mendoza, Cooper and Davis",Assimilated needs-based concept for embrace dynamic supply-chains,,Assimilated needs-based concept for embrace dynamic supply-chains,0.0
255,Johnson-Miller,Monitored maximized policy for evolve 24/7 communities,,Monitored maximized policy for evolve 24/7 communities,0.0
174,Anderson Group,Configurable intermediate info-mediaries for empower virtual models,,Configurable intermediate info-mediaries for empower virtual models,0.0
173,Taylor Ltd,Reactive eco-centric solution for incentivize impactful bandwidth,,Reactive eco-centric solution for incentivize impactful bandwidth,0.0
257,Mclaughlin and Sons,Intuitive exuding encoding for envisioneer customized e-tailers,,Intuitive exuding encoding for envisioneer customized e-tailers,0.0
171,Romero Group,Profit-focused asynchronous structure for monetize bleeding-edge users,,Profit-focused asynchronous structure for monetize bleeding-edge users,0.0
240,Levy LLC,Optimized system-worthy workforce for harness bleeding-edge schemas,,Optimized system-worthy workforce for harness bleeding-edge schemas,0.0
310,Phillips Group,Innovative scalable artificial intelligence for orchestrate virtual models,,Innovative scalable artificial intelligence for orchestrate virtual models,-0.04999999999999999
84,Lambert-Phillips,Profound secondary toolset for generate synergistic applications,,Profound secondary toolset for generate synergistic applications,-0.10833333333333334
197,"Hunter, Harris and Tyler",Expanded secondary open system for drive integrated platforms,,Expanded secondary open system for drive integrated platforms,-0.15
130,"Hall, Heath and Perez'","Managed 3rdgeneration artificial intelligence for optimize seamless '
 'ROI'",,"Managed 3rdgeneration artificial intelligence for optimize seamless '
 'ROI'",-0.25
24,"Castro, Pace and Jimenez"," ""Expanded didactic projection for benchmark global e-tailers",," ""Expanded didactic projection for benchmark global e-tailers",-0.25
220,"Johnson, Morgan and Lopez",Streamlined secondary strategy for benchmark web-enabled e-business,,Streamlined secondary strategy for benchmark web-enabled e-business,-0.3
172,Grimes Inc,De-engineered secondary support for visualize robust architectures,,De-engineered secondary support for visualize robust architectures,-0.3
135,Flores Inc,Self-enabling secondary framework for target extensible e-services,,Self-enabling secondary framework for target extensible e-services,-0.3
297,"Franklin, Flynn and Bell",Pre-emptive secondary projection for re-contextualize sticky e-markets,,Pre-emptive secondary projection for re-contextualize sticky e-markets,-0.3
448,Patrick Ltd,Extended didactic workforce for matrix cross-media solutions,49.0,Extended didactic workforce for matrix cross-media solutions,-0.5
312,Stevens-King,Reduced didactic interface for grow next-generation e-business,,Reduced didactic interface for grow next-generation e-business,-0.5
58,"Craig, Weber and Wolfe",Down-sized didactic implementation for grow transparent e-services,,Down-sized didactic implementation for grow transparent e-services,-0.5
423,Bates-Johnson,Distributed didactic portal for mesh integrated synergies,24.0,Distributed didactic portal for mesh integrated synergies,-0.5
361,"Wolfe, Martinez and Alvarado", Vision-oriented didactic help-desk for unleash web-enabled users,, Vision-oriented didactic help-desk for unleash web-enabled users,-0.5
490,Smith-Russo,Quality-focused didactic portal for evolve robust channels,,Quality-focused didactic portal for evolve robust channels,-0.5
53,Johnson Ltd,Synchronized clear-thinking artificial intelligence for cultivate efficient interfaces,,Synchronized clear-thinking artificial intelligence for cultivate efficient interfaces,-0.6
295,Wright LLC,Triple-buffered 6thgeneration artificial intelligence for grow 24/7 vortals,,Triple-buffered 6thgeneration artificial intelligence for grow 24/7 vortals,-0.6
191,Marshall LLC,Monitored stable artificial intelligence for drive front-end schemas,,Monitored stable artificial intelligence for drive front-end schemas,-0.6
184,Stevenson-Copeland,Future-proofed multi-state artificial intelligence for incentivize 24/365 platforms,,Future-proofed multi-state artificial intelligence for incentivize 24/365 platforms,-0.6
180,"Coffey, Barron and Morse",Front-line regional artificial intelligence for synthesize turn-key eyeballs,,Front-line regional artificial intelligence for synthesize turn-key eyeballs,-0.6
94,Fleming Ltd,Compatible maximized artificial intelligence for orchestrate sticky ROI,,Compatible maximized artificial intelligence for orchestrate sticky ROI,-0.6
