,Name,Purpose,Unnamed: 0,Blob,Sentiment Score
459,Davidson Ltd,Object-based non-volatile protocol for deliver clicks-and-mortar e-services,,Object-based non-volatile protocol for deliver clicks-and-mortar e-services,0.0
458,Simpson and Sons,Ameliorated encompassing website for expedite proactive platforms,,Ameliorated encompassing website for expedite proactive platforms,0.0
457,Roberts and Sons,Sharable 4thgeneration open system for transform cross-platform e-tailers,,Sharable 4thgeneration open system for transform cross-platform e-tailers,0.0
456,"Jackson, Holden and Gonzalez",Intuitive eco-centric productivity for iterate dot-com action-items,,Intuitive eco-centric productivity for iterate dot-com action-items,0.0
455,Huerta and Sons,Intuitive discrete contingency for repurpose synergistic schemas,,Intuitive discrete contingency for repurpose synergistic schemas,0.0
454,Roberts Ltd,Extended mission-critical intranet for matrix cross-media paradigms,,Extended mission-critical intranet for matrix cross-media paradigms,0.0
453,"Anderson, Stevens and Jensen",Pre-emptive high-level extranet for enhance value-added platforms,,Pre-emptive high-level extranet for enhance value-added platforms,0.0
452,"Cabrera, Levine and Underwood",Proactive analyzing Internet solution for engage web-enabled e-business,,Proactive analyzing Internet solution for engage web-enabled e-business,0.0
451,Harper-Boone,Open-source fault-tolerant knowledge user for embrace clicks-and-mortar e-services,,Open-source fault-tolerant knowledge user for embrace clicks-and-mortar e-services,0.0
450,Dunn LLC,Implemented mission-critical function for extend front-end niches,,Implemented mission-critical function for extend front-end niches,0.0
449,Bruce Group,Organized 3rdgeneration migration for deploy leading-edge portals,,Organized 3rdgeneration migration for deploy leading-edge portals,0.0
447,Myers and Sons,Organized upward-trending methodology for facilitate dynamic metrics,48.0,Organized upward-trending methodology for facilitate dynamic metrics,0.0
446,Rivera-Flores,Proactive client-server interface for expedite out-of-the-box ROI,47.0,Proactive client-server interface for expedite out-of-the-box ROI,0.0
445,Cardenas Group,Phased stable monitoring for facilitate robust architectures,46.0,Phased stable monitoring for facilitate robust architectures,0.0
444,Rodriguez PLC,Integrated object-oriented moratorium for aggregate vertical paradigms,45.0,Integrated object-oriented moratorium for aggregate vertical paradigms,0.0
443,"Miller, Jensen and Nash",User-centric bifurcated analyzer for synthesize interactive infrastructures,44.0,User-centric bifurcated analyzer for synthesize interactive infrastructures,0.0
442,Larson-Steele,Enhanced directional pricing structure for empower sticky interfaces,43.0,Enhanced directional pricing structure for empower sticky interfaces,0.0
441,Morgan Inc,Self-enabling tangible migration for repurpose bleeding-edge portals,42.0,Self-enabling tangible migration for repurpose bleeding-edge portals,0.0
440,"Anderson, Smith and Cox",Multi-tiered even-keeled matrix for synthesize back-end platforms,41.0,Multi-tiered even-keeled matrix for synthesize back-end platforms,0.0
439,Pope and Sons,Horizontal asymmetric Local Area Network for seize sticky bandwidth,40.0,Horizontal asymmetric Local Area Network for seize sticky bandwidth,0.0
437,Schwartz PLC,Polarized high-level software for morph strategic deliverables,38.0,Polarized high-level software for morph strategic deliverables,0.0
464,Davis-Meyers,Public-key client-driven orchestration for engineer synergistic interfaces,,Public-key client-driven orchestration for engineer synergistic interfaces,0.0
466,Smith PLC,Open-source grid-enabled contingency for target enterprise info-mediaries,,Open-source grid-enabled contingency for target enterprise info-mediaries,0.0
467,"Olson, Murray and Johnson",Synergistic 3rdgeneration extranet for repurpose 24/365 communities,,Synergistic 3rdgeneration extranet for repurpose 24/365 communities,0.0
484,"White, Lewis and Chambers",Synergized web-enabled utilization for syndicate transparent partnerships,,Synergized web-enabled utilization for syndicate transparent partnerships,0.0
497,Wiggins-Wright,Intuitive incremental implementation for synergize dynamic functionalities,,Intuitive incremental implementation for synergize dynamic functionalities,0.0
496,Brown Group,Object-based maximized groupware for deliver bricks-and-clicks niches,,Object-based maximized groupware for deliver bricks-and-clicks niches,0.0
495,"Reynolds, Bell and Russell",Centralized clear-thinking portal for syndicate best-of-breed vortals,,Centralized clear-thinking portal for syndicate best-of-breed vortals,0.0
494,Patel Ltd,Profit-focused executive moderator for redefine magnetic deliverables,,Profit-focused executive moderator for redefine magnetic deliverables,0.0
493,Coleman-Espinoza,Visionary human-resource capability for revolutionize turn-key interfaces,,Visionary human-resource capability for revolutionize turn-key interfaces,0.0
492,"Logan, Thomas and Calhoun",Mandatory tangible intranet for productize global experiences,,Mandatory tangible intranet for productize global experiences,0.0
491,"Burke, Prince and Sanders",Synergized national protocol for architect next-generation convergence,,Synergized national protocol for architect next-generation convergence,0.0
489,"Hill, Robbins and Cruz",Virtual contextually-based info-mediaries for iterate 24/365 info-mediaries,,Virtual contextually-based info-mediaries for iterate 24/365 info-mediaries,0.0
488,Savage-Jones,Customer-focused even-keeled encryption for engage cross-platform e-markets,,Customer-focused even-keeled encryption for engage cross-platform e-markets,0.0
487,Davis Group,Open-architected eco-centric knowledgebase for integrate virtual communities,,Open-architected eco-centric knowledgebase for integrate virtual communities,0.0
486,Juarez and Sons,Enterprise-wide non-volatile emulation for maximize robust vortals,,Enterprise-wide non-volatile emulation for maximize robust vortals,0.0
482,Powell-Hamilton,Enterprise-wide motivating circuit for reinvent proactive markets,,Enterprise-wide motivating circuit for reinvent proactive markets,0.0
468,Sullivan and Sons,User-centric mobile architecture for grow next-generation systems,,User-centric mobile architecture for grow next-generation systems,0.0
481,Weeks-Glass,Synchronized 4thgeneration collaboration for envisioneer distributed metrics,,Synchronized 4thgeneration collaboration for envisioneer distributed metrics,0.0
480,Johnson Ltd,Customer-focused logistical complexity for synergize customized portals,,Customer-focused logistical complexity for synergize customized portals,0.0
479,Bauer Ltd,Cross-platform uniform archive for aggregate plug-and-play bandwidth,,Cross-platform uniform archive for aggregate plug-and-play bandwidth,0.0
478,Brown-Ross,De-engineered systemic open system for engage distributed info-mediaries,,De-engineered systemic open system for engage distributed info-mediaries,0.0
477,Edwards Ltd,Reduced methodical hierarchy for target bricks-and-clicks e-markets,,Reduced methodical hierarchy for target bricks-and-clicks e-markets,0.0
476,Doyle-Foley,Persistent maximized portal for morph 24/7 communities,,Persistent maximized portal for morph 24/7 communities,0.0
475,Spence PLC,Monitored client-server system engine for mesh 24/7 ROI,,Monitored client-server system engine for mesh 24/7 ROI,0.0
474,Goodwin PLC,Enhanced methodical info-mediaries for re-intermediate strategic web-readiness,,Enhanced methodical info-mediaries for re-intermediate strategic web-readiness,0.0
471,"Gordon, Smith and Evans",User-friendly heuristic customer loyalty for implement bleeding-edge e-services,,User-friendly heuristic customer loyalty for implement bleeding-edge e-services,0.0
470,"Flores, Moore and Powell",Distributed radical structure for transition cross-media applications,,Distributed radical structure for transition cross-media applications,0.0
469,Lopez-Russo,Future-proofed multimedia approach for scale revolutionary models,,Future-proofed multimedia approach for scale revolutionary models,0.0
436,"Harrison, Garcia and Patterson",Cross-platform global methodology for visualize ubiquitous convergence,37.0,Cross-platform global methodology for visualize ubiquitous convergence,0.0
435,Coleman-Lopez,Managed composite structure for implement out-of-the-box models,36.0,Managed composite structure for implement out-of-the-box models,0.0
434,Decker-Grant,Customizable high-level encryption for engineer open-source partnerships,35.0,Customizable high-level encryption for engineer open-source partnerships,0.0
385,Castillo Group, Configurable grid-enabled toolset for visualize viral systems,, Configurable grid-enabled toolset for visualize viral systems,0.0
396,Jacobson Ltd, Vision-oriented optimizing monitoring for synthesize next-generation relationships,, Vision-oriented optimizing monitoring for synthesize next-generation relationships,0.0
395,Garcia LLC, Re-contextualized zero-defect matrices for expedite customized deliverables,, Re-contextualized zero-defect matrices for expedite customized deliverables,0.0
394,Williams-Phillips, Ergonomic local synergy for brand user-centric markets,, Ergonomic local synergy for brand user-centric markets,0.0
393,Briggs and Sons, Multi-layered web-enabled paradigm for syndicate cutting-edge applications,, Multi-layered web-enabled paradigm for syndicate cutting-edge applications,0.0
392,"Robertson, Powell and Wise", Phased 6thgeneration hierarchy for engage dynamic convergence,, Phased 6thgeneration hierarchy for engage dynamic convergence,0.0
391,Morrison and Sons, Mandatory disintermediate neural-net for envisioneer visionary markets,, Mandatory disintermediate neural-net for envisioneer visionary markets,0.0
390,"Turner, Jackson and Santos", Inverse demand-driven firmware for deliver e-business relationships,, Inverse demand-driven firmware for deliver e-business relationships,0.0
389,"Mitchell, Olson and Alexander", Sharable local analyzer for whiteboard cutting-edge eyeballs,, Sharable local analyzer for whiteboard cutting-edge eyeballs,0.0
388,Winters Group, Switchable modular utilization for morph front-end platforms,, Switchable modular utilization for morph front-end platforms,0.0
387,Miller-Smith, Multi-channeled human-resource conglomeration for integrate user-centric eyeballs,, Multi-channeled human-resource conglomeration for integrate user-centric eyeballs,0.0
386,Bradley LLC, Integrated actuating open architecture for expedite B2B supply-chains,, Integrated actuating open architecture for expedite B2B supply-chains,0.0
384,Mcdonald and Sons, Self-enabling logistical toolset for embrace user-centric schemas,, Self-enabling logistical toolset for embrace user-centric schemas,0.0
398,Chambers Ltd, Organic high-level neural-net for repurpose revolutionary eyeballs,, Organic high-level neural-net for repurpose revolutionary eyeballs,0.0
383,Gonzalez and Sons, Robust 3rdgeneration secured line for incubate global solutions,, Robust 3rdgeneration secured line for incubate global solutions,0.0
382,"Norman, Lindsey and Schmidt", Expanded responsive emulation for optimize 24/7 eyeballs,, Expanded responsive emulation for optimize 24/7 eyeballs,0.0
381,Gonzalez-Strickland, Realigned zero tolerance intranet for iterate collaborative applications,, Realigned zero tolerance intranet for iterate collaborative applications,0.0
262,Nelson-Brown,Function-based systemic contingency for re-contextualize visionary mindshare,,Function-based systemic contingency for re-contextualize visionary mindshare,0.0
379,Thompson-Roy, Public-key human-resource policy for reinvent extensible platforms,, Public-key human-resource policy for reinvent extensible platforms,0.0
378,"Buchanan, Thompson and Frye", Sharable 6thgeneration attitude for synthesize back-end initiatives,, Sharable 6thgeneration attitude for synthesize back-end initiatives,0.0
375,Wright PLC, Profit-focused web-enabled customer loyalty for extend collaborative paradigms,, Profit-focused web-enabled customer loyalty for extend collaborative paradigms,0.0
374,"Green, Holland and Bennett", Enhanced clear-thinking extranet for visualize killer e-markets,, Enhanced clear-thinking extranet for visualize killer e-markets,0.0
373,Lee and Sons, Stand-alone optimal strategy for engineer ubiquitous supply-chains,, Stand-alone optimal strategy for engineer ubiquitous supply-chains,0.0
372,Johnson-Washington, Organized encompassing definition for syndicate web-enabled niches,, Organized encompassing definition for syndicate web-enabled niches,0.0
371,Hicks-Hayes, Phased dedicated paradigm for benchmark front-end e-tailers,, Phased dedicated paradigm for benchmark front-end e-tailers,0.0
397,"Harris, Young and Burns", Inverse stable interface for facilitate leading-edge e-business,, Inverse stable interface for facilitate leading-edge e-business,0.0
399,"Montoya, Camacho and Harrison",Compatible bottom-line structure for grow vertical e-services,0.0,Compatible bottom-line structure for grow vertical e-services,0.0
433,Orr-Pierce,Polarized dedicated encoding for strategize plug-and-play methodologies,34.0,Polarized dedicated encoding for strategize plug-and-play methodologies,0.0
417,Hanna Group,Team-oriented grid-enabled workforce for enhance magnetic applications,18.0,Team-oriented grid-enabled workforce for enhance magnetic applications,0.0
431,Le-Brock,Team-oriented clear-thinking productivity for grow value-added e-services,32.0,Team-oriented clear-thinking productivity for grow value-added e-services,0.0
430,Castillo PLC,Vision-oriented well-modulated capacity for leverage world-class web services,31.0,Vision-oriented well-modulated capacity for leverage world-class web services,0.0
429,King-Washington,Reverse-engineered mobile middleware for expedite cross-media vortals,30.0,Reverse-engineered mobile middleware for expedite cross-media vortals,0.0
428,Hicks-Lewis,Persistent zero tolerance synergy for productize distributed models,29.0,Persistent zero tolerance synergy for productize distributed models,0.0
427,Farley Group,Ergonomic dedicated function for scale customized action-items,28.0,Ergonomic dedicated function for scale customized action-items,0.0
426,Landry-Schmidt,Inverse content-based process improvement for envisioneer plug-and-play models,27.0,Inverse content-based process improvement for envisioneer plug-and-play models,0.0
425,Ball LLC,Exclusive intangible Graphic Interface for target back-end methodologies,26.0,Exclusive intangible Graphic Interface for target back-end methodologies,0.0
424,"Vance, Michael and Stafford",Triple-buffered transitional encoding for grow impactful initiatives,25.0,Triple-buffered transitional encoding for grow impactful initiatives,0.0
421,Levy-Garrison,Proactive multi-tasking approach for mesh next-generation vortals,22.0,Proactive multi-tasking approach for mesh next-generation vortals,0.0
419,Smith-Farmer,Up-sized object-oriented utilization for exploit frictionless initiatives,20.0,Up-sized object-oriented utilization for exploit frictionless initiatives,0.0
418,Walter PLC,Fundamental explicit extranet for enable integrated action-items,19.0,Fundamental explicit extranet for enable integrated action-items,0.0
416,Schmidt-Brown,Open-architected grid-enabled projection for deploy next-generation content,17.0,Open-architected grid-enabled projection for deploy next-generation content,0.0
400,Walker Group,Self-enabling asynchronous encryption for embrace revolutionary functionalities,1.0,Self-enabling asynchronous encryption for embrace revolutionary functionalities,0.0
415,"Huffman, Norton and Cantu",Cloned client-driven system engine for envisioneer killer mindshare,16.0,Cloned client-driven system engine for envisioneer killer mindshare,0.0
414,Powell Ltd,Enterprise-wide intangible contingency for extend frictionless infrastructures,15.0,Enterprise-wide intangible contingency for extend frictionless infrastructures,0.0
413,"Mcclain, Mccarthy and Lozano",Upgradable clear-thinking data-warehouse for drive killer convergence,14.0,Upgradable clear-thinking data-warehouse for drive killer convergence,0.0
412,Hill PLC,Self-enabling global firmware for synergize web-enabled eyeballs,13.0,Self-enabling global firmware for synergize web-enabled eyeballs,0.0
407,Carroll Group,Horizontal national capability for extend bricks-and-clicks platforms,8.0,Horizontal national capability for extend bricks-and-clicks platforms,0.0
406,Knight Inc,Fundamental global help-desk for integrate web-enabled infrastructures,7.0,Fundamental global help-desk for integrate web-enabled infrastructures,0.0
405,Yu-Mckenzie,Ergonomic asynchronous interface for facilitate leading-edge partnerships,6.0,Ergonomic asynchronous interface for facilitate leading-edge partnerships,0.0
404,Massey-Atkinson,Ameliorated systematic database for expedite value-added e-commerce,5.0,Ameliorated systematic database for expedite value-added e-commerce,0.0
403,Cruz-Powell,De-engineered 5thgeneration database for morph proactive platforms,4.0,De-engineered 5thgeneration database for morph proactive platforms,0.0
402,"Smith, Richardson and Wright",Devolved homogeneous projection for embrace integrated e-commerce,3.0,Devolved homogeneous projection for embrace integrated e-commerce,0.0
401,Maldonado-Curtis,Switchable background customer loyalty for whiteboard impactful eyeballs,2.0,Switchable background customer loyalty for whiteboard impactful eyeballs,0.0
263,Davis-Flores,Up-sized object-oriented superstructure for aggregate bricks-and-clicks channels,,Up-sized object-oriented superstructure for aggregate bricks-and-clicks channels,0.0
249,Francis and Sons,Automated 4thgeneration initiative for seize distributed synergies,,Automated 4thgeneration initiative for seize distributed synergies,0.0
261,Johnson-Wilson,Grass-roots neutral focus group for optimize granular infrastructures,,Grass-roots neutral focus group for optimize granular infrastructures,0.0
66,Aguilar LLC,Customer-focused hybrid database for optimize e-business models,,Customer-focused hybrid database for optimize e-business models,0.0
96,Fleming Inc,Implemented intermediate matrices for orchestrate magnetic experiences,,Implemented intermediate matrices for orchestrate magnetic experiences,0.0
95,"Allen, Evans and Patel",Front-line upward-trending throughput for e-enable viral infrastructures,,Front-line upward-trending throughput for e-enable viral infrastructures,0.0
93,Anderson LLC,Digitized analyzing secured line for synthesize efficient e-tailers,,Digitized analyzing secured line for synthesize efficient e-tailers,0.0
92,Zhang-Hill,Ergonomic directional hub for revolutionize end-to-end models,,Ergonomic directional hub for revolutionize end-to-end models,0.0
91,"Cox, Livingston and Davis",Total non-volatile firmware for grow world-class networks,,Total non-volatile firmware for grow world-class networks,0.0
90,Tran-Morris,Operative exuding neural-net for matrix value-added vortals,,Operative exuding neural-net for matrix value-added vortals,0.0
89,Martinez-Miles,Reactive context-sensitive leverage for optimize e-business supply-chains,,Reactive context-sensitive leverage for optimize e-business supply-chains,0.0
88,Wilson-Hernandez,Open-architected bottom-line conglomeration for harness end-to-end info-mediaries,,Open-architected bottom-line conglomeration for harness end-to-end info-mediaries,0.0
87,"Norton, Santana and Evans",Automated reciprocal service-desk for unleash virtual e-commerce,,Automated reciprocal service-desk for unleash virtual e-commerce,0.0
86,Merritt Ltd,Sharable maximized moratorium for empower cutting-edge niches,,Sharable maximized moratorium for empower cutting-edge niches,0.0
82,Weiss-Hernandez,Customizable background help-desk for productize collaborative metrics,,Customizable background help-desk for productize collaborative metrics,0.0
81,"Hall, Jackson and Robertson",Down-sized modular website for synthesize virtual ROI,,Down-sized modular website for synthesize virtual ROI,0.0
80,Turner-Nelson,Programmable local website for visualize enterprise supply-chains,,Programmable local website for visualize enterprise supply-chains,0.0
79,Mclean and Sons,Open-architected modular ability for integrate turn-key methodologies,,Open-architected modular ability for integrate turn-key methodologies,0.0
78,"Dawson, Cardenas and Flores",Phased local access for integrate B2C web-readiness,,Phased local access for integrate B2C web-readiness,0.0
77,Taylor Ltd,Progressive mobile info-mediaries for benchmark bleeding-edge niches,,Progressive mobile info-mediaries for benchmark bleeding-edge niches,0.0
76,Andrews Group,Total eco-centric interface for whiteboard killer mindshare,,Total eco-centric interface for whiteboard killer mindshare,0.0
75,Baker-Johnson,Horizontal grid-enabled function for seize global networks,,Horizontal grid-enabled function for seize global networks,0.0
74,Cox-Sandoval,Reactive optimal solution for generate e-business metrics,,Reactive optimal solution for generate e-business metrics,0.0
73,"Smith, Richardson and Johnson",Configurable fault-tolerant infrastructure for transition collaborative communities,,Configurable fault-tolerant infrastructure for transition collaborative communities,0.0
72,"Bird, Parker and Cole",Future-proofed clear-thinking approach for harness B2B web-readiness,,Future-proofed clear-thinking approach for harness B2B web-readiness,0.0
71,Fritz Group,Robust directional functionalities for morph open-source users,,Robust directional functionalities for morph open-source users,0.0
70,Clark Ltd,Business-focused fault-tolerant initiative for visualize dot-com e-services,,Business-focused fault-tolerant initiative for visualize dot-com e-services,0.0
69,"Rice, Holden and Gomez",Switchable methodical budgetary management for expedite proactive networks,,Switchable methodical budgetary management for expedite proactive networks,0.0
68,Woods Inc,Distributed well-modulated utilization for morph cross-platform content,,Distributed well-modulated utilization for morph cross-platform content,0.0
97,"Ferguson, Brown and Floyd",Devolved zero administration middleware for deploy transparent info-mediaries,,Devolved zero administration middleware for deploy transparent info-mediaries,0.0
98,"Wong, Williams and Moreno",Quality-focused tangible software for exploit world-class applications,,Quality-focused tangible software for exploit world-class applications,0.0
99,Pennington and Sons,Proactive neutral definition for utilize wireless deliverables,,Proactive neutral definition for utilize wireless deliverables,0.0
116,Williams Group,Optimized tangible installation for embrace distributed synergies,,Optimized tangible installation for embrace distributed synergies,0.0
131,"Williams, Gomez and Butler'","Polarized multimedia Graphical User Interface for morph distributed '
 'initiatives'",,"Polarized multimedia Graphical User Interface for morph distributed '
 'initiatives'",0.0
260,Castillo-Schroeder,Vision-oriented national secured line for productize turn-key convergence,,Vision-oriented national secured line for productize turn-key convergence,0.0
127,Reed-Wolfe,Optional 24/7 implementation for enable sticky applications,,Optional 24/7 implementation for enable sticky applications,0.0
126,Ball and Sons',"Quality-focused asymmetric toolset for harness bleeding-edge '
 'platforms'",,"Quality-focused asymmetric toolset for harness bleeding-edge '
 'platforms'",0.0
125,Ramos and Sons,Re-engineered dedicated paradigm for cultivate intuitive users,,Re-engineered dedicated paradigm for cultivate intuitive users,0.0
124,Hayes-Hall,Automated content-based paradigm for generate real-time applications,,Automated content-based paradigm for generate real-time applications,0.0
122,"Coleman, Miller and Baldwin'","Progressive cohesive infrastructure for innovate open-source '
 'functionalities'",,"Progressive cohesive infrastructure for innovate open-source '
 'functionalities'",0.0
121,Pratt-Hoffman,Multi-lateral encompassing contingency for enable proactive vortals,,Multi-lateral encompassing contingency for enable proactive vortals,0.0
120,Grant-Nichols,Automated background frame for evolve best-of-breed paradigms,,Automated background frame for evolve best-of-breed paradigms,0.0
119,Hudson Group',"Cross-platform background Graphic Interface for re-contextualize '
 '24/7 applications'",,"Cross-platform background Graphic Interface for re-contextualize '
 '24/7 applications'",0.0
118,Wells-Allen,User-centric maximized hierarchy for unleash one-to-one content,,User-centric maximized hierarchy for unleash one-to-one content,0.0
115,"Castaneda, Myers and Ray",Persevering 24hour strategy for streamline user-centric relationships,,Persevering 24hour strategy for streamline user-centric relationships,0.0
100,Perry and Sons,Realigned zero-defect conglomeration for generate back-end portals,,Realigned zero-defect conglomeration for generate back-end portals,0.0
113,Stanton-Myers',"Exclusive tangible approach for re-intermediate efficient '
 'partnerships'",,"Exclusive tangible approach for re-intermediate efficient '
 'partnerships'",0.0
112,Hayden-Rogers,Horizontal multi-state ability for matrix end-to-end eyeballs,,Horizontal multi-state ability for matrix end-to-end eyeballs,0.0
111,Curry-Jones,Balanced responsive superstructure for cultivate e-business models,,Balanced responsive superstructure for cultivate e-business models,0.0
110,Holmes LLC,Robust homogeneous forecast for re-intermediate vertical interfaces,,Robust homogeneous forecast for re-intermediate vertical interfaces,0.0
109,"Oconnor, Scott and Harmon",Adaptive grid-enabled ability for deploy collaborative architectures,,Adaptive grid-enabled ability for deploy collaborative architectures,0.0
